{
  "stage": "stage1_c_onboarding",
  "stage_title": "C 언어 (온보딩)",
  "unit": 6,
  "unit_title": "함수",
  "questions": [
    {
      "id": "foundation_stage1_u06_q001",
      "type": "predict_output",
      "code": "int add(int a, int b) {\n    return a + b;\n}\n\nint main() {\n    int result = add(3, 4);\n    printf(\"%d\", result);\n    return 0;\n}",
      "prompt_en": "What is printed?",
      "prompt_ko": "출력 결과는?",
      "options": ["7", "34", "3", "오류"],
      "answer": 0,
      "explanation_en": "add(3, 4) returns 3 + 4, which is 7, and that value is stored in result before being printed.",
      "explanation_ko": "add(3, 4)는 3 + 4의 결과인 7을 반환하고, 그 값이 result에 저장되어 출력됩니다.",
      "concept_tags": ["function", "return_value"],
      "difficulty": "intro"
    },
    {
      "id": "foundation_stage1_u06_q002",
      "type": "order",
      "code": null,
      "prompt_en": "Arrange the execution flow of the code above (calling add(3, 4)) in the correct order.",
      "prompt_ko": "위 코드에서 add(3, 4)가 호출될 때의 실행 흐름을 올바른 순서로 배열하세요.",
      "items": [
        "main 함수 실행 중 add(3, 4)를 호출한다",
        "제어가 add 함수로 넘어가고, a=3, b=4로 매개변수가 채워진다",
        "return a + b가 실행되어 7이 계산된다",
        "7이라는 값과 함께 제어가 main으로 돌아오고, result에 7이 저장된다"
      ],
      "correct_order": [0, 1, 2, 3],
      "explanation_en": "Calling a function transfers control to it, executes its body with the given arguments, then returns the result back to the caller.",
      "explanation_ko": "함수를 호출하면 제어가 그 함수로 넘어가 전달받은 인자로 본문을 실행하고, 결과값과 함께 다시 호출한 곳으로 돌아옵니다.",
      "concept_tags": ["function", "function_call"],
      "difficulty": "practice"
    },
    {
      "id": "foundation_stage1_u06_q003",
      "type": "fill_blank",
      "code": "____ multiply(int a, int b) {\n    return a * b;\n}",
      "prompt_en": "Fill in the blank with the correct return type, given the function returns an integer.",
      "prompt_ko": "이 함수가 정수를 반환한다고 할 때, 빈칸에 들어갈 올바른 반환형은?",
      "options": ["int", "void", "float", "char"],
      "answer": 0,
      "explanation_en": "A function's return type must match the type of the value it returns; since a * b is an int, the return type should be int.",
      "explanation_ko": "함수의 반환형은 실제로 반환하는 값의 자료형과 일치해야 합니다. a * b는 정수이므로 반환형은 int여야 합니다.",
      "concept_tags": ["function", "return_value"],
      "difficulty": "intro"
    },
    {
      "id": "foundation_stage1_u06_q004",
      "type": "predict_output",
      "code": "void changeValue(int x) {\n    x = 100;\n}\n\nint main() {\n    int num = 5;\n    changeValue(num);\n    printf(\"%d\", num);\n    return 0;\n}",
      "prompt_en": "What is printed?",
      "prompt_ko": "출력 결과는?",
      "options": ["100", "5", "0", "오류"],
      "answer": 1,
      "explanation_en": "C passes arguments by value, so changeValue receives a copy of num; changing x inside the function does not affect num in main.",
      "explanation_ko": "C는 매개변수를 값으로 전달합니다. 즉 changeValue는 num의 복사본을 받으며, 함수 안에서 x를 바꿔도 main의 num에는 영향을 주지 않습니다.",
      "concept_tags": ["function", "parameter", "pass_by_value"],
      "difficulty": "challenge"
    },
    {
      "id": "foundation_stage1_u06_q005",
      "type": "concept_quiz",
      "code": null,
      "prompt_en": "What does void mean as a function's return type?",
      "prompt_ko": "함수의 반환형이 void라는 것은 무엇을 의미할까요?",
      "options": [
        "함수가 항상 0을 반환한다",
        "함수가 아무 값도 반환하지 않는다",
        "함수가 아무 매개변수도 받지 않는다",
        "함수에 오류가 있다는 뜻이다"
      ],
      "answer": 1,
      "explanation_en": "void indicates that the function performs an action but does not return any value to the caller.",
      "explanation_ko": "void는 함수가 어떤 동작을 수행하지만 호출한 곳으로 값을 반환하지는 않는다는 뜻입니다.",
      "concept_tags": ["function", "return_value"],
      "difficulty": "intro"
    },
    {
      "id": "foundation_stage1_u06_q006",
      "type": "concept_matching",
      "code": null,
      "prompt_en": "Match each term to its description.",
      "prompt_ko": "용어와 설명을 올바르게 연결하세요.",
      "pairs": [
        { "term": "함수 선언", "definition": "함수의 이름·매개변수·반환형만 미리 알려주는 것" },
        { "term": "함수 정의", "definition": "함수가 실제로 무엇을 하는지 본문을 작성하는 것" },
        { "term": "매개변수", "definition": "함수 호출 시 전달받는 값을 담는 자리" },
        { "term": "값에 의한 전달", "definition": "함수에 인자를 전달할 때 원본이 아닌 복사본이 전달되는 방식" }
      ],
      "explanation_en": "Together these terms explain how C organizes and passes data into reusable blocks of code.",
      "explanation_ko": "이 용어들은 C가 재사용 가능한 코드 블록을 조직하고 데이터를 전달하는 방식을 설명합니다.",
      "concept_tags": ["function", "parameter", "pass_by_value"],
      "difficulty": "practice"
    }
  ]
}
